{
  "schema_version": "agentflow.project_index.overview.v1",
  "repo": "/fixture/repo",
  "generated_at": "2026-05-11T00:00:00.000Z",
  "summary": "Fixture TypeScript service with auth code and tests.",
  "languages": [
    {
      "name": "TypeScript",
      "confidence": "high"
    }
  ],
  "key_directories": [
    {
      "path": "src",
      "purpose": "Runtime source."
    },
    {
      "path": "tests",
      "purpose": "Automated tests."
    }
  ],
  "entrypoints": [
    {
      "path": "src/index.ts",
      "kind": "library",
      "description": "Package entrypoint."
    }
  ],
  "modules": [
    {
      "module_id": "auth",
      "name": "Authentication",
      "summary": "Authentication service and tests.",
      "module_ref": ".agentflow/project-index/modules/auth.json"
    }
  ],
  "test_strategy": {
    "summary": "Run the auth-focused test suite.",
    "command_refs": ["test"]
  },
  "build_strategy": {
    "summary": "Run TypeScript compilation.",
    "command_refs": ["typecheck"]
  }
}
